{
  "schema_version": "BossHuntResearchDossierV3",
  "run_id": "run-v3-synthetic-001",
  "researcher_id": "researcher-synthetic",
  "role": {
    "target_id": "J-000123", "source_tracker_id": "J-000123", "intake_mode": "LIVE_REQUISITION",
    "company": "Example Company", "company_domain": "example.com", "role_title": "Director of Product Design",
    "job_url": "https://careers.example.com/jobs/director-product-design", "jd_source": "synthetic/example-jd.md",
    "posting_status": "OPEN", "geography": "Mexico", "function": "Product Design", "explicit_boss_titles": ["VP Product"],
    "authority_sources": [{"authority_type": "LOCAL_ROLE_RECORD", "source_ref": "synthetic/role-J-000123.json", "observed_at": "2026-08-21T09:00:00-06:00", "authority_scope": "J-000123 identity and read-only research", "evidence_sha256": "sha256:aaaaaaaaaaaaaaaaaaaaaaaaaaaaaaaaaaaaaaaaaaaaaaaaaaaaaaaaaaaaaaaa"}],
    "owner_scope": "Read-only synthetic research; zero live connectors and credits."
  },
  "capabilities": {
    "local_role_authority": {"state": "AVAILABLE", "observed_at": "2026-08-21T09:00:00-06:00", "scope": "synthetic target", "receipt_ref": "receipt:local-role", "evidence_sha256": "sha256:1111111111111111111111111111111111111111111111111111111111111111"},
    "public_web": {"state": "AVAILABLE", "observed_at": "2026-08-21T09:00:00-06:00", "scope": "synthetic evidence", "receipt_ref": "receipt:public-web", "evidence_sha256": "sha256:2222222222222222222222222222222222222222222222222222222222222222"},
    "authenticated_profile": {"state": "AVAILABLE", "observed_at": "2026-08-21T09:00:00-06:00", "scope": "synthetic profile", "receipt_ref": "receipt:auth-profile", "evidence_sha256": "sha256:3333333333333333333333333333333333333333333333333333333333333333"},
    "hunter_account_details": {"state": "UNAVAILABLE", "observed_at": "2026-08-21T09:00:00-06:00", "scope": "offline eval", "receipt_ref": "receipt:hunter-account", "evidence_sha256": "sha256:4444444444444444444444444444444444444444444444444444444444444444"},
    "hunter_email_finder": {"state": "UNAVAILABLE", "observed_at": "2026-08-21T09:00:00-06:00", "scope": "offline eval", "receipt_ref": "receipt:hunter-finder", "evidence_sha256": "sha256:5555555555555555555555555555555555555555555555555555555555555555"},
    "hunter_domain_search": {"state": "NOT_APPLICABLE", "observed_at": "2026-08-21T09:00:00-06:00", "scope": "named route resolved", "receipt_ref": "receipt:hunter-domain", "evidence_sha256": "sha256:6666666666666666666666666666666666666666666666666666666666666666"},
    "local_python": {"state": "AVAILABLE", "observed_at": "2026-08-21T09:00:00-06:00", "scope": "local scripts", "receipt_ref": "receipt:python", "evidence_sha256": "sha256:7777777777777777777777777777777777777777777777777777777777777777"},
    "schema_validation": {"state": "AVAILABLE", "observed_at": "2026-08-21T09:00:00-06:00", "scope": "V3", "receipt_ref": "receipt:schema", "evidence_sha256": "sha256:8888888888888888888888888888888888888888888888888888888888888888"}
  },
  "guards": {
    "overall_state": "CLEAR",
    "receipts": [
      {"guard": "NO_BYPASS", "result": "CLEAR", "source_ref": "synthetic/history.json", "observed_at": "2026-08-21T09:05:00-06:00", "authority_scope": "company and target", "evidence_sha256": "sha256:0101010101010101010101010101010101010101010101010101010101010101", "run_id": "run-v3-synthetic-001"},
      {"guard": "TERMINAL_OUTREACH", "result": "CLEAR", "source_ref": "synthetic/history.json", "observed_at": "2026-08-21T09:05:00-06:00", "authority_scope": "company and target", "evidence_sha256": "sha256:0202020202020202020202020202020202020202020202020202020202020202", "run_id": "run-v3-synthetic-001"},
      {"guard": "OWNER_CLOSED", "result": "CLEAR", "source_ref": "synthetic/history.json", "observed_at": "2026-08-21T09:05:00-06:00", "authority_scope": "company and target", "evidence_sha256": "sha256:0303030303030303030303030303030303030303030303030303030303030303", "run_id": "run-v3-synthetic-001"},
      {"guard": "COMPANY_COLLISION", "result": "CLEAR", "source_ref": "synthetic/history.json", "observed_at": "2026-08-21T09:05:00-06:00", "authority_scope": "company-wide", "evidence_sha256": "sha256:0404040404040404040404040404040404040404040404040404040404040404", "run_id": "run-v3-synthetic-001"},
      {"guard": "DISCONFIRMATION", "result": "CLEAR", "source_ref": "synthetic/disconfirmers.json", "observed_at": "2026-08-21T09:05:00-06:00", "authority_scope": "recipient and company", "evidence_sha256": "sha256:0505050505050505050505050505050505050505050505050505050505050505", "run_id": "run-v3-synthetic-001"}
    ]
  },
  "search": {
    "reporting_hypotheses": [{"title": "VP Product", "basis": "Synthetic JD states reports to VP Product.", "would_support": "Current VP Product with matching scope.", "would_refute": "Current org source assigns design elsewhere."}],
    "literal_seat_result": "HIT",
    "queries_run": [
      {"stage": "EMPLOYER_CONTEXT", "surface": "synthetic-employer", "query": "resolve employer and role", "observed_at": "2026-08-21T09:10:00-06:00", "outcome": "HIT", "result_url": "https://example.com/careers/director-product-design", "run_id": "run-v3-synthetic-001", "note": "Synthetic evidence."},
      {"stage": "LITERAL_SEAT", "surface": "synthetic-public", "query": "Example VP Product", "observed_at": "2026-08-21T09:12:00-06:00", "outcome": "HIT", "result_url": "https://example.com/team/jordan", "run_id": "run-v3-synthetic-001", "note": "Candidate only."},
      {"stage": "REPORTING_ALTERNATIVES", "surface": "synthetic-public", "query": "Example alternative", "observed_at": "2026-08-21T09:14:00-06:00", "outcome": "MISS", "result_url": null, "run_id": "run-v3-synthetic-001", "note": null},
      {"stage": "REQUISITION_AND_SEARCH_OWNER", "surface": "synthetic-public", "query": "Example hiring owner", "observed_at": "2026-08-21T09:16:00-06:00", "outcome": "MISS", "result_url": null, "run_id": "run-v3-synthetic-001", "note": null},
      {"stage": "ADJACENT_ROUTES", "surface": "synthetic-public", "query": "Example adjacent routes", "observed_at": "2026-08-21T09:18:00-06:00", "outcome": "MISS", "result_url": null, "run_id": "run-v3-synthetic-001", "note": null},
      {"stage": "AUTHENTICATED_CURRENTNESS", "surface": "synthetic-profile", "query": "observe Jordan current role", "observed_at": "2026-08-21T09:20:00-06:00", "outcome": "HIT", "result_url": "https://profiles.example.com/in/jordan", "run_id": "run-v3-synthetic-001", "note": "Synthetic currentness."},
      {"stage": "HOOK_ARTIFACT", "surface": "synthetic-employer", "query": "Jordan operating model", "observed_at": "2026-08-21T09:25:00-06:00", "outcome": "HIT", "result_url": "https://example.com/insights/jordan-operating-model", "run_id": "run-v3-synthetic-001", "note": "Exact synthetic artifact."},
      {"stage": "EMAIL_DISCOVERY_FIRST_PARTY", "surface": "synthetic-employer", "query": "published professional address", "observed_at": "2026-08-21T09:30:00-06:00", "outcome": "HIT", "result_url": "https://example.com/team/jordan", "run_id": "run-v3-synthetic-001", "note": "No Hunter required."}
    ],
    "authenticated_currentness": {"capability_receipt_ref": "receipt:auth-profile", "surface": "synthetic-profile", "identity_binding": {"recipient_name": "Jordan Example", "profile_url": "https://profiles.example.com/in/jordan", "company": "Example Company", "target_id": "J-000123"}, "observed_at": "2026-08-21T09:20:00-06:00", "fresh_until": "2026-08-22T09:20:00-06:00", "result": "CONFIRMED", "evidence_ref": "synthetic/profile-readback.json", "evidence_sha256": "sha256:9999999999999999999999999999999999999999999999999999999999999999", "run_id": "run-v3-synthetic-001"}
  },
  "recipient": {"name": "Jordan Example", "current_title": "VP Product", "route_class": "LIKELY_HM", "requisition_linkage": "ADJACENT", "profile_url": "https://profiles.example.com/in/jordan", "currentness_sources": [
    {"url": "https://profiles.example.com/in/jordan", "observed_at": "2026-08-21T09:20:00-06:00", "run_id": "run-v3-synthetic-001", "supports": "CURRENT_TITLE_AND_EMPLOYER", "source_family": "AUTHENTICATED_PROFILE", "independence_key": "profile:jordan", "content_sha256": "sha256:abababababababababababababababababababababababababababababababab"},
    {"url": "https://example.com/team/jordan", "observed_at": "2026-08-21T09:22:00-06:00", "run_id": "run-v3-synthetic-001", "supports": "CURRENT_TITLE_AND_EMPLOYER", "source_family": "EMPLOYER", "independence_key": "employer:jordan", "content_sha256": "sha256:bbbbbbbbbbbbbbbbbbbbbbbbbbbbbbbbbbbbbbbbbbbbbbbbbbbbbbbbbbbbbbbb"}
  ]},
  "hook": {"text": "Jordan described a product operating-model change.", "attribution": "PERSON", "artifact_url": "https://example.com/insights/jordan-operating-model", "artifact_date": "2026-06-15", "observed_at": "2026-08-21T09:25:00-06:00", "support_excerpt": "Jordan explains the operating-model change.", "support_state": "SUPPORTED", "run_id": "run-v3-synthetic-001", "evidence_binding": {"intent_id": "recipient-authored-operating-model", "result_url": "https://example.com/insights/jordan-operating-model", "content_sha256": "sha256:cdcdcdcdcdcdcdcdcdcdcdcdcdcdcdcdcdcdcdcdcdcdcdcdcdcdcdcdcdcdcdcd", "run_id": "run-v3-synthetic-001"}},
  "hook_search": {"policy_version": "BossHuntHookSearchV2", "fallback_kind": "RECIPIENT_SPECIFIC", "coverage_claim": "COMPLETE", "intents": [